ID,Name,Content,Event,Skip
1,Narrator,"수사를 계속하던 중, 당신의 휴대폰으로 한 통의 전화가 왔다.",1,0
3,Narrator,"윗선에서 적당히 용의자들 기소하고 수사 종결 하라고 명령 떨어졌다. 수화기 너머로 낙담한듯한 선배 경찰의 목소리가 들려왔다.,1,0
4,Narrator,"시간을 보니 자정이었다. 어제부로 모든 형사에게 철수 명령이 떨어진 것이다.",1,0
5,Narrator,"확실한 증거를 찾지 못한 채 그렇게 두 용의자는 재판에 회부되었다.",2,0
6,Narrator,"이경숙 씨는 무죄를 선고받았다. 주변의 시선이 그녀를 의심으로 뒤덮었지만, 그녀는 아랑곳하지 않았다.",2,0
7,Narrator,"김예나 씨는 법원 문턱을 넘으며 혐의 없음 판결을 받아들였다. 얼굴에는 후회도 고통도 없이 무표정만이 남아 있었다.",2,0
8,Narrator,"두 용의자가 나란히 빠져나가는 뒷모습은 허무함만 남긴 채 어둠으로 사라졌다. 정의의 저울은 단지 증거의 무게만을 재었을 뿐이었다.",2,0
9,Narrator,"내부 수사팀은 책임을 떠넘기기에 급급했고, 누구도 사건의 본질을 쫓지 않았다. 수사는 이렇게 뒷전으로 밀려났다.",3,0
10,Narrator,"주인공은 죄책감에 경찰을 그만두고 흔적 없이 사라져 버렸다. 미궁에 빠진 사건만이 그의 이름을 기억했다.",4,0
11,System,"엔딩 3: 게임오버.",4,0